{
  "apiVersion": "hosting.lowerduckpond.net/v1alpha1",
  "kind": "OperationRequest",
  "operation": "create",
  "correlationId": "0198d17f-6f4a-7000-8000-000000000001",
  "tenantId": "0191e2c4-8f7a-7c3b-8d1e-5f62047a2100",
  "slug": "duck-repair",
  "quotas": {
    "storageMiB": 100,
    "entries": 5000
  }
}
